{
  "schema": 1,
  "status": "incomplete",
  "technology": "lightpanda",
  "technology_version": "0.4.0",
  "artifact_sha256": "840547bb7b98743a3e32618a4d120ac4a75e7c3c2d227ecf5ce8d508ddc118b7",
  "platform": {
    "os": "macos",
    "os_version": "26.5.1",
    "architecture": "arm64"
  },
  "workload": {
    "id": "W1",
    "transport": "data-url",
    "fixture_sha256": "1d562146735fcb83bb7086769135c3db8ac795c1c0e3776aaf687022c86ec9e5",
    "repetitions": 7
  },
  "measurement": {
    "memory_semantic": "bsd-time-process-maximum-resident-set-size",
    "process_scope": "root-process-only; no child process observed during this short fetch, stronger sampler pending",
    "samples": [
      { "wall_seconds": 0.03, "memory_bytes": 25575424 },
      { "wall_seconds": 0.03, "memory_bytes": 25591808 },
      { "wall_seconds": 0.03, "memory_bytes": 25690112 },
      { "wall_seconds": 0.03, "memory_bytes": 25575424 },
      { "wall_seconds": 0.03, "memory_bytes": 25542656 },
      { "wall_seconds": 0.03, "memory_bytes": 25575424 },
      { "wall_seconds": 0.03, "memory_bytes": 25526272 }
    ]
  },
  "agent_observation": {
    "interface": "semantic_tree_text+cdp-1.3-discovery",
    "expected_present": true,
    "output_sha256": "d86889d401f520f7d4561f0df2ea4fcd988cd84864ee0e6d273f0b870fd07b0e"
  },
  "limitations": [
    "same-machine browser baseline pending",
    "complete process-tree sampler pending",
    "single short hermetic document only",
    "CDP target/action journey pending",
    "macos-arm64 only"
  ]
}
